,text,requesting_help,disaster
1059,they did this with the also during a civil emergency,0,fire
1060,such a great night for all the right reasons at at gravenstein grill,0,fire
1061,nasa satellite images from nov show that california s kincade fire has damaged  acres of land and destroyed structures read the story here,0,fire
1062,thank you for your generous donations over the last few weeks the has been able to help almost families impacted by the receive diapers wipes and a few teddy bears,0,fire
1063,natural disasters strike without warning note that stands ready to extend tax relief to an area once a presidential declaration of disaster is issued,0,fire
1068,my lasted from  through th the th th days in sept this is a photo of my bill where its clear theyre charging me when my power was shut off look at th where usage spiked care to explain,0,fire
1069,two years ago in october my area had the my comic group met in november to discuss s tea dragons book this october my area had the the group met last night to discuss tea dragon festival,0,fire
1070,california crisis of fires blackouts decades in the making,0,fire
1071,things are getting back to normal here at the winery with the under control we look to get caught up on winery duties we are shipping out the current orders so if you have wine coming expect it soon link in bio to arrange an appointment,0,fire
1072,tell your story take the survey to tell how you we re impacted by the,0,fire
1073,thoughts san francisco sonoma county looking for,0,fire
1074,this pretty female cat was brought to on last sat found on cochrane way in no microchip please call if you know this kitty thank you,0,fire
1075,after the ruined their lives we were blessed to make them smile again thank you and for making this distribution day successful true heroes,0,fire
1076,thank you sonoma magazine for including us in your article about giving back to the sonoma county community after the,0,fire
1077,my buddy matt wrote a great piece on all the places to visit in sonoma that are thriving despite the as someone who also lives in wine country and bushfire country in oz im pleased to see this kind of coverage these are small businesses that need your support,0,fire
1078,state regulators voted today to open a formal investigation into series of controversial widespread power outages to reduce wildfire risk more this afternoon on,0,fire
1079,a summary has been published describing the record breaking fire weather conditions that impacted the region october  have a look,0,fire
1080,thoughts san francisco state puc to investigate,0,fire
1081,your client may need to reconstruct records after a disaster for taxes or insurance see,0,fire
1082,the was burning for a couple of days and the said mph winds were coming i live in santa rosa california and my home was surrounded by evacuation zones as my wife and i talked about leaving i started thinking about my books,0,fire
1083,if you experienced agricultural losses it is extremely important to report those losses so that assistance funding may result please report your losses here,0,fire
1084,natural disasters strike without warning note that stands ready to extend tax relief to an area once a presidential declaration of disaster is issued  via irsnews,0,fire
1085,natural disasters strike without warning note that stands ready to extend tax relief to an area once a presidential declaration of disaster is issued,0,fire
1086,is your home in or near a location in sonoma or napa counties affected by the wildfires give us a call at right away to get a free price quote and schedule an appointment,0,fire
1087,rt people need to know,0,fire
1088,proud to introduce the newest member of the gore family we were evacuated to the same shelter area as this puppy we loved him then and got to bring him home last night we named him after the terrible to show that good can come out of bad,0,fire
1089,san francisco magazine hosted best of wine country awards last night at the pearl in san francisco with ticket proceeds to victims it was a fabulous event and so nice to see friends from all over the,0,fire
1090,rt can grant relief to a disaster area following a presidential declaration of disaster this rundown may help,0,fire
1091,it was fate sent from il replaced lost toy in,0,fire
1092,no one is immune to jeanne sternbergh disaster action team member lost her home in healdsburg to the her advice on preparing for next time,0,fire
1093,pg e is offering  billion to california wildfire victims,0,fire
1094,square miles burned people for comparison the recent californian was square miles,0,fire
1095,cleanup burden shifting to homeowners because not enough property burned interesting that no mention of pg e fiscal responsibility appeared in this article,0,fire
1096,hazardous waste cleanup begins this week for victims in sonoma county and the county is picking up the  tab for the first phase but the second more expensive phase falls on homeowners,0,fire
1097,first responders heroes thank you from the bottom of our hearts to all the firefighters law enforcement first responders and volunteers for saving our towns and our homes,0,fire
1098,so our research tech ryan is super quick on the mapmaking and he made us this awesome map of the burn perimeter can you say,0,fire
1099,if you want more of my footage from the take a look below,0,fire
1100,the fire was declared extinguished wednesday november th burning through  acres damaging structures destroying structures injuring four,0,fire
1101,here is some good news our neighbors have a pop up tasting room as they recover from the cant wait to go yay,0,fire
1102,with winter here side eyes i know theres probably some feral cats so heres the graphic on how to create shelters for them reminder styrofoam straw you know me  grin,0,fire
1103,local breweries wineries restaurants and stores raise funds for survivors first responders thank you for including us in a great list of local fundraising initiatives,0,fire
1104,and are still beautiful after the let s go visit and support local businesses and enjoy the and fine there,0,fire
1105,clean up crews are starting to scoop up hazardous household waste in and around properties impacted by our is in the fire zone today and i will talk to him about the work ahead at pm,0,fire
1106,nachos a doorstop readers share the strangest things they grabbed during the evacuations,0,fire
1107,great to see the communities come together after the,0,fire
1108,helping the folks in ca recover from,0,fire
1109,another resource for agricultural losses is contact them as well as nrcs take photos keep receipts and keep a diary of losses and repairs,0,fire
1110,a tree off highway in smoldered and the breeze blowing embers around,0,fire
1111,thanks for sharing your no the didn t level sonoma county so go visit via,0,fire
1112,double what it was during,0,fire
1113,support order some awesome wine today at because of their trust in fusion s based backup soda rock is able to continue to operate off site despite the loss of their physical facility in the,0,fire
1114,did you receive november s paws press enewsletter in this month s issue we introduced lottie a special puppy arf rescued from the if you d like to join our mailing list sign up at the link below,0,fire
1115,hwy still partially closed in the area,0,fire
1116,not sure how things work there but in us a sofe dec means special funding kicks in so it is a good thing having just gone thru here my heart goes out to nsw ive been there lovely place hope they contain it soon,0,fire
1117,sonoma county ca treated equally badly in  california afraid of denial did not request individual assistance for winter flooding is not requesting a declaration for the kincade fire fmag covers fire suppression only,0,fire
1118,yes we weathered a big fire last month but sonoma county is more beautiful than ever in my latest for i give a rundown on the real effects of the and provide tips for how to help the region recover,0,fire
1119,jeff thomsen had returned to find his home destroyed by the but heroic efforts from members of the ophir hill fire department blunted the sting of tragedy,0,fire
1120,a view of the soda rock winery destroyed in sonoma county s that started on oct  photo taken nov  thomson reuters foundation ellen wulfhorst,0,fire
1121,live video is live at a m talking about cleanup,0,fire
1122,research suggests that climate change is driving ca s wildfires however for the climate change was probably secondary as a cause,0,fire
1123,rebirth angst and the new normal of california wildfires,0,fire
1124,sure the was scary and serious but reports of sonoma countys demise have been greatly exaggerated my latest for,0,fire
1125,because the damage wasnt severe enough the cost of debris removal is falling on sonoma county and affected land owners,0,fire
1126,one of the best stories i have read about the to date i linked to it in this story for,0,fire
1127,icymi my attempt to capture the pivotal fight to defend windsor and prevent the from running through west,0,fire
1128,cleanup begins tuesday with hazmat removal first then debris ash and soil no oversight unlike  because this fire was not damaging enough to qualify as state or federal disaster,0,fire
1129,you can make a difference in sonoma county,0,fire
1130,listening to the fighfighters on scanners fighting to save sydney scary how much it sounds like  when will we take seriously we are just racking up the death and destruction by ignoring it,0,fire
1131,thinking about the recent and i m so thankful for the first responders but even more thankful to god for protection,0,fire
1132,just putting this back out there,0,fire
1133,our oregon firefighters that deployed to california to assist in response efforts with the and are returning home proud and grateful for their service and i hope they all have happy reunions with their families and loved ones,0,fire
1134,thank you for coming to sonoma county and volunteering during,0,fire
1135,behold the work of crew came out on their last day of class to help out with the post fire fight clean up and ecological restoration to you all,0,fire
1136,last day to donate to the eastern ways martial arts,0,fire
1137,you have to be a rock you have to reassure people that its going to be ok when electricity internet and cell service were down people relied on local radio for information and comfort during the more from,0,fire
1138,when fires did ignite many communities in harm s way likely benefited from having more defensible space thanks to greater emphasis on fuel reduction projects aimed at removing excess vegetation that might otherwise burn contained,0,fire
1139,donate to community fund here,0,fire
1140,thoughts san francisco wine country wildfire,0,fire
1141,i neglected to mark myself safe during the kincade fire sorry,0,fire
1142,some amazing science performed on the frontlines of the,0,fire
1143,the in sonoma county prompted large scale evacuations on oct and forced thousands of residents to flee their homes but it wasn t just humans that were displaced by the fire pets and animals living at shelters also had to evacuate,0,fire
1144,rt winespectator icymi our latest on the,0,fire
1145,icymi our latest on the,0,fire
1146,contained zero loss of life thanks firefighters first responders,0,fire
1147,lot s of local support to get folks out in to the community to help support these businesses,0,fire
1148,disparate treatment no major disaster declaration for california not big bad enough mississippi dr included individual assistance for survivors no ia for sonoma on winter storms no major declaration for kincade fire,0,fire
1149,just a reminder that our local businesses especially in the food space can use our support now,0,fire
1150,as we mark the anniversary of remember that it can be a difficult reflection for many with response its mass evacuations the past weeks this possibility is even more likely if you need to talk call disaster distress helpline at,0,fire
1151,one of our visiting scholars cory is monitoring several black oaks throughout on a project w our native advisory council black oak trees are a culturally significant resource hes on the team to monitor how theyve fared,0,fire
1152,by all accounts preparedness plans worked calfire declared the extinguished on november  after it scorched  acres there was no loss of life electeds help lead the charge in preparedness,0,fire
1153,sonomas wine country struggles with a new label fire country via,0,fire
1154,wineries are back to business following the kincade fire and encouraging visitors to and via,0,fire
1155,paradise community gathers on anniversary of camp fire,0,fire
1156,redwood pal golden bears football team is from santa rosa ca kids raising to compete in a tournament in az this is the nd time n yrs that our fundraising efforts have been impacted by the wildfires their story,0,fire
1157,over  people came to dinner in paradise tonight on anniversary thank you to everyone who helped make it happen to our amazing wck volunteers many who were just serving at we are proud to continue standing with the paradise community,0,fire
1158,san jose s plan to turn pg e into co op gains widespread backing,0,fire
1159,of apparel proceeds will be donated to those affected by the wildfires,0,fire
1160,we love our town city of celebrates welcome home party following evacuations reports,0,fire
1161,rt at one north bay restaurant the owner learned a very expensive lesson during the don t trust pg e especially during fire season,0,fire
1162,over  people came to our dinner in paradise tonight on the anniversary thank you to everyone who helped make it happen to our amazing wck volunteers many who were just serving at the we are proud to continue standing with the paradise community,0,fire
1163,ff working the recent,0,fire
1164,the health impact of wildfires,0,fire
1165,fire of light after the,0,fire
1166,at one north bay restaurant the owner learned a very expensive lesson during the he says he wont keep as much inventory on hand especially during fire season,0,fire
1167,welcome home healdsburg a night of joy celebration and gratitude in the plaza tonight a community wide thank you to every first responder city staff member and dozens of volunteers who stepped to help their neighbors during the town s time of need,0,fire
1168,use o armor to save your oxygen from the tyranny of pg e,0,fire
1169,san francisco san francisco day around the  text squad to  text squad to,0,fire
1170,three of the four firefighter injuries from the are under investigation by cal osha talked to the oregon man who suffered the most severe injury and remains hospitalized,0,fire
1171,trick or treat healdsburg style community coming together to celebrate first responders and give kids a chance to trick or treat after having been evacuated due to the,0,fire
1172,thoughts san francisco low amount of burned homes,0,fire
1173,in it was such a lifeline we were in an evacuation warning from the first day on when your power s out internet s off and there s no cell service radio still works heres how it helped during the,0,fire
1174,explore the space podcast episode is up vicki white is chief nursing officer at santa rosa memorial hospital we focus on leading a hospital that did not evacuate during she s superb her insights are invaluable,0,fire
1175,this article from on the lived experience of the impact of is excellent,0,fire
1176,three sonoma state university students were arrested on suspicion of burglarizing dorms during the and pg e they are not the only ones suspected of exploiting communities affected by the fire and outages story by,0,fire
1177,you guys should do a story on the inaccurate and or lack of reporting on air quality by it is a hazard to the health of children when schools rely on their accurate report,0,fire
1178,after the struck in a weather advisory was issued on  threatening displaced survivors and those w o power our team immediately distributed  blankets to protect families from the cold weather learn more at,0,fire
1179,healdsburg is holding a welcome home event for residents after the forced them to leave their town maggie medeiros her husband hank skewis and their friend linda cott came to thank first responders they put their lives on the line everyday for us medeiros at healdsburg plaza,0,fire
1180,winemaker patrick melley has our november update which is now up on,0,fire
1181,is contained,0,fire
1182,nasa satellite image shows damage from space,0,fire
1183,a large burn scar can be seen from space where the has burned through sonoma county,0,fire
1184,today state superintendent of public instruction expressed his appreciation and support to sonoma county superintendents today for their responses to the recent public safety power shutoffs and the while paying a visit to scoe,0,fire
1185,some can argue that small biz need every penny to survive but a corp like has plenty in profits should not have put their employees at risk during the  learn more about their,0,fire
1186,last week closed because of in that time at least dorm rooms were burglarized this was a very disappointing and frustrating situation given that it occurred in the midst of a regional crisis my latest for,0,fire
1187,sonoma state university students arrested on suspicion of burglarizing at least dozen dorm rooms while campus was evacuated,0,fire
1188,it was ok here we go again and i really just right away go to when electricity internet and cell service are down people relied on local radio for information during the more from,0,fire
1189,wineshipping offering assistance to victims,0,fire
1190,how to support businesses,0,fire
1191,knows what its like to lose a building or two to wildfires so it recently provided free pizza to firefighters and victims of the,0,fire
1192,local businesses in sonoma county are opening their doors again after the and they need your support from shopping to eating to volunteering shares a few ways you can help,0,fire
1193,three sonoma state university students were arrested on suspicion of ransacking empty dorms during the,0,fire
1194,thoughts san francisco sonoma state students,0,fire
1195,mediocre smoke conditions continue throughout the bay area about as bad as during s better days it hit several times in sf in last hours dwindling again zero media or agency coverage of continuing low quality,0,fire
1196,one of two northern california power agency geothermal plants has resumed normal plant operations after an interruption in the facilities operations due to the,0,fire
1197,it took months of pushing but kqed came thru on nov two days b anniversary with story on importance of am radio in fast reliable radio is essential for alerts ty kqed are you listening,0,fire
1198,contained thank you firefighters god bless you all,0,fire
1199,no federal money to help landowners and the county of sonoma clean up after the thanks mr president,0,fire
1200,while lives were lost in last year s fire we will never forget it s important to understand acknowledge that worked tirelessly to put out the now contained as of days ago and no lives were lost,0,fire
1201,state superintendent is meeting with top school officials this morning to debrief on the and a month of psps impacts story coming on the challenges educators are facing right now,0,fire
1202,were here  at,0,fire
1203,analyst eric hoffmann quoted in on the financial and credit impact of the on municipal governments across,0,fire
1204,its not my fucking fault has destroyed the air i have to try and breath maybe take it up with them and and,0,fire
1205,but again you have let down the people of sonoma county by not obtaining individual assistance for winter storm flooding and fires survivors,0,fire
1206,fema rt hhsregion between the anniversary of this years feelings may be intense if you need to talk distressline is here call text talkwithus to  web,0,fire
1207,we are all in this together check out this list of nearly more agencies from around our country that answered the call and fought the we cannot thank you enough for helping keep our communities safe,0,fire
1208,bushfires are raging through southeastern and have possibly killed hundreds of koalas at one nature reserve this comes as firefighters finally contain s and as friday marks the first anniversary of the,0,fire
1209,mcn is dedicated to serving the needs of clinicians including those who serve patients in the midst of disasters like the california fires five on friday this week has articles on those recovering from the as well as those impacted by the and,0,fire
1210,some incredible photos of the by pulitzer prize winning photographer kent porter,0,fire
1211,shared by matt gustafson a big thank you from windsor ca for those who fought against the kincade fire in sonoma county thanks matt,0,fire
1212,santa rosa nursing students were unsung heroes in fire shelters,0,fire
1213,between the anniversary of this years feelings may be intense if you need to talk is here call text talkwithus to  web,0,fire
1214,satellite captures awful scar left by california s historic,0,fire
1215,heres a nice article about the resilience of sonoma county ca residents,0,fire
1216,the red cross will continue offering support to community members who have damaged or destroyed homes when friday and saturday  monday  through friday  time  a m  p m where  aero dr santa rosa ca,0,fire
1217,recent wildfires in california s wine country are among the largest and most destructive in state history october s massive is the latest in a wave of fires that are dramatically reshaping life in the region,0,fire
1218,good foggy morning from west coast grateful conquered by brave incredibly hard working first responders pg e workers complain to executives workers are doing an almost impossible task what s coming today,0,fire
1219,the latest eat drink and be you daily thanks to,0,fire
1220,the burned close to square miles and endangered close to  structures it is tragic that buildings peoples homes and workplaces were destroyed but it is a hard earned miracle that there was not a single fatality thank you,0,fire
1221,my honest quote about the via,0,fire
1222,the latest firefighters hurt battling california blaze,0,fire
1223,warming temperatures play an important role in california s uptick in wildfires however fire scientists say that strong winds not forest fuels drove the s growth,0,fire
1224,big big thank you to the firefighters rescuers medical professionals and every single person who helped,0,fire
1225,closing in on going video shows water diverted over pacific,0,fire
1226,the red cross will continue offering support to community members who have damaged or destroyed homes by when friday and saturday  monday  through friday  time  a m  p m where  aero dr santa rosa ca,0,fire
1227,metallica donates  to california wildfire relief variety,0,fire
1228,sonomas wineries and restaurants reopen their doors to returning visitors and the vintage has survived the,0,fire
1229,s biggest most ruinous wildfire this year which scorched sq miles of sonoma county wine country consumed scores of homes has been declared extinguished two weeks after erupting,0,fire
1230,we re so happy to report that the is contained,0,fire
1231,pg e expects more than billion in wildfire costs this year,0,fire
1232,my latest article on the,0,fire
1233,the update on the,0,fire
1234,thank you chpexplorerpost for your help during the officers worked long shifts and you were there to help in any way you could including those dirty jobs of taking out the trash and washing and,0,fire
1235,photo through the windshield on south of soda rock winery with like comment share follow me at ig davemillsphoto fb davemillsphoto twitter davemillsphoto,0,fire
1236,the is contained at  acres in county here are your local firefighters who have returned safe and sound from the welcome back thank you to all of the firefighters who are working to keep california communities safe,0,fire
1237,my family s homes were spared kincade fire in sonoma county fully contained,0,fire
1238,beloved geyserville mail carrier loses her house in kincade fire awe,0,fire
1239,chilly tonight in and neighbors have a fire going seems unreal after,0,fire
1240,windsor firefighters saving homes at the recent,0,fire
1241,the foley family foley family wines the vegas golden knights and city national bank are donating over  to aid in the fire recovery and support efforts following the,0,fire
1242,bad news im having somewhat of a bipolar relapse because of the and having to be evacuated and all that stuff im home now but all the adrenaline has left my body and ive crashed im crying more often and having more depressive swings,0,fire
1243,is it customary to be ghosted by your adjuster when trying to figure out next steps on a claim ive reached out twice this week and crickets,0,fire
1244,our teams first week back on the preserve has had its ups and downs all in all were glad to be together as we take stock of the work ahead,0,fire
1245,um it burns underbrush have you ever heard of a controlled back burn it saved my house during the by the way every firefighter or police officer i ve ever talked with support and so do i you re welcome,0,fire
1246,now full contained,0,fire
1247,all of the updates you need in local state news the pg e news people leaving the a mini horse on s on news around will die faster news about the planet,0,fire
1248,i mean this is a stab in the dark pun but maybe the decrease has to do with my power being off of the month oh,0,fire
1249,beautiful sunset here in santa rosa a few days after thank you mother nature,0,fire
1250,what a beautiful sunset to help celebrate that the is contained napa valley,0,fire
