,text,requesting_help,disaster
473,take photos videos of you belongings don t forget the cash and domino table thanks sharing preparation tips with agent in spanish,0,hurricane
474,just in time for dorian,0,hurricane
475,agreed i had to do the same and got hit with in fees don t fly jetblue they don t care about your safety just money,0,hurricane
476,im following and as if i was an addict waiting for the pusher,0,hurricane
478,my latest for the grassroots organization prepares to help those in need after,0,hurricane
479,much gratitude to and all the folks at for the highly professional work forecasting this stubbornly unpredictable,0,hurricane
480,please destroy my school in all the entirety please,0,hurricane
481,this is how i feel about dorian ruining the perfectly planned nothing i was going to do over my day weekend,0,hurricane
482,most powerful hurricane in u s history hit the florida keys on labor day keep in contact during hurricane,0,hurricane
483,the calm before the storm i m cutting vacation short by three days and heading back to tomorrow  atlantic beach and th,0,hurricane
484,the only thing i care about right now,0,hurricane
485,busy preparing for a major hurricane and just checked the dnfs for today s stage,0,hurricane
486,if you havent been called a redneck cracker or used all yall in the last week you have to queue at the front of the line,0,hurricane
487,our price gouging command center is open extended hours and our reporting app no scam can be used to report related gouging  more from reporter jake stofan,0,hurricane
488,if your gas tank is half full your ok no need to panic drive to gas stations to find gas tankers are enroute stay calm,0,hurricane
491,nothing in my way to slow me down before florida y all really ain t ready,0,hurricane
492,heres a question how accurate have the forecasts for been up to this point wasnt it supposed to hit puerto rico,0,hurricane
493,be aware and be safe and god bless you,0,hurricane
494,feels strange hoping that a resort is in s path but given the ludicrous amount of time spends there how can we not,0,hurricane
495,the more you buy the further the hurricane seems to go,0,hurricane
496,where s trump and his nukes when you need em,0,hurricane
497,will he return,0,hurricane
498,got them s on there i just got dem,0,hurricane
499,president s message on i ll have full updates beginning at am tomorrow when i fill in for on,0,hurricane
500,my forecast keeping an eye on which could be a major act storm before making landfall this labor day plus our holiday weekend and the hotter more humid conditions thanks for,0,hurricane
501,hurricane this week bless up,0,hurricane
502,the new power of location risk analytics analytics says hurricane dorian cone of uncertainty includes  homes at risk,0,hurricane
503,sh ts getting real so to speak,0,hurricane
504,lord i hope not we don t need another year flood down here in louisiana,0,floods
506,for a number of reasons the other types of insurance you listed do not make good parallels to health insurance and need not be administered by the govt a much better parallel is flood insurance in louisiana,0,floods
507,our cause in partnership with addresses the ongoing need to restore and rebuild areas affected by the louisiana flood and superstorm sandy give a unique gift in honor of someone and help them rebuild,0,floods
508,we used to grow it then the louisiana floods happened need to plant again,0,floods
509,in states like louisiana if youre trying to close on a home during the holidays and need flood insurance youll have to wait to close because fema isnt open during the govt shutdown thanks president trump,0,floods
510,tropical storm imelda has left immense flood waters primarily affecting the gulf coast primarily in the houston galveston area and western louisiana please share these resources with any cultural institutions that may need help recovering,0,floods
511,anything would be appreciated storm flood victims always come to mind wish i knew you when travelling philanthropy was possible didnt need money myself filled a boat with supplies towed it to louisiana did search rescue of katrina victims gave the boat to red cross,0,floods
513,louisiana flood he did fundraise but many articles of him golfing while homes destroyed i think they need an outlet regardless of optics trump gets the criticism,0,floods
515,moron i guess puerto rico needs to put stilts under their island louisiana you need to grow some legs so you arent on the water oh and hey texas you wouldnt flood if you raised your roads up off the,0,floods
517,what about the hurricanes florida louisiana need to clean up their act every year the same thing and floods and tornadoes in the midwest clean it all up bigly people,0,floods
518,if you live in south louisiana don t know how to drive in flood waters you need to relocate,0,floods
521,look at louisiana if hrc runs she will when because the clintons r great at fixing after a loss they have had years of unobstructed mass legal and illegal immigration to flood the counties they need to flip states,0,floods
522,watch question gov edwards about flood victims doesnt need get out and vote,0,floods
523,breaking a flash flood emergency has been issued in southern louisiana including houma until am ct as heavy rain will lead to life threatening flash flooding in these parishes move to higher ground and do not travel unless you need to or are told to evacuate,0,floods
524,for example in durham v mcfarland gay clay inc  so d la ct app  the court of appeal of louisiana affirmed judgment in favor of an insured where an agent breached his duty to advise the insured of the need for residential flood protection,0,floods
525,lets get it louisiana we know all about getting help when its need it pay it forward its not a flood but its who we are help spread the word,0,floods
529,national flood insurance program soy bean crisis farm bill hunger relief government shutdown all must pass bills facing congress all bills we need all bills he abandoned if he really wants to help louisiana maybe he should do the job we elected him to do,0,floods
531,how about signing the waiver for restore louisiana you got lots of voters here in louisiana that have already suffered enough with the flood sign the legislation give them the well deserved relief they need,0,floods
536,in need of car insursnce we can help call us ig nolamax insurance,0,floods
537,thank you greenwell springs baptist church for having me this morning after years in louisiana for the floods is moving on to another need so i wanted to be sure to tell them thank you this morning,0,floods
538,not sure if you need flood insurance look at your driver s license if it says louisiana you need flood insurance kimberly poorbaugh of at,0,floods
539,i m sure that will make sure the students learn the skills they need or stave off rising sea levels from global warming that will flood southern louisiana,0,floods
540,the st tammany parish council in louisiana is considering tougher rules for building in floodplains siding with flood wary residents over developers who say they need more flexibility via,0,floods
545,well to be literal last year i was in louisiana for flood recovery two years ago i was getting ready to move to israel right now i woke up late and need to bust my ass to get to school to teach and i ve had a rough two months can i go back to last year,0,floods
546,years ago during katrina and today they are there already where theres animal need they always answer they have had my respect and love for many years update disaster team response to louisiana floods,0,floods
547,does anyone remember when he handed out boxes of playdoh to louisiana flood victims how degrading that must have been to them this appears to be a pattern w trump the need to humiliate ppl when they re already down,0,floods
548,i just pray it doesn t flood louisiana doesn t need another one of those,0,floods
549,who did you check your facts with august  louisiana flood he wouldnt cut his week vacation short i think you need some new fact checkers,0,floods
550,this saved the of a and during a catastrophic flood in louisiana we need more people like him double tap to show your respect repostit app,0,floods
551,the august floods are still fresh in the minds of many citizens in louisiana with that in mind gov john bel edwards spoke at a gohsep news conference about the need to be prepared ahead of time,0,floods
552,silence suddenly on re due to need along the is going to flood soon need to target tv waking media back up,0,floods
553,don t move south i m from south louisiana and the reason everyone drives trucks isn t because it floods every time it rains but the roads are so bad you need the grown clearance because it would fuck up a small car the potholes fuck you so hard you call them daddy,0,floods
554,nebraskans need to adopt the system my old man had in south louisiana where we know a little about floods hed have me walk out in front of the pickup truck when the road to camp had flooded out along with everything else if i suddenly disappeared,0,floods
555,as often as louisiana floods you may need noah to save you,0,floods
556,clearly a lie you have just told but go on he has a pages essay on his plan for climate change but go ahead if you dont think we need to move some people away from places where floods are happening the you havent heard about the town in louisiana,0,floods
557,can you imagine one studied and observed that some people are the way they are everything you need to know is encrypted inside your dna tribulations and no floods in louisiana,0,floods
558,what s gonna prove who s right losing the peninsula of florida to the ocean flood waters in texas and louisiana that don t recede fires in the west that burn uncontrollably for an entire season as opposed to several weeks how much destruction do u need,0,floods
559,don t let them give it to the red cross they pocket all the money while hindering actual help to those in need they were such a scam in louisiana s hurricanes katrina rita and gustav as well as the great flood fo,0,floods
560,yall really got katrina trending nobody from louisiana or texas need to talk about surviving a flood some of yall lost people from flooding and still joke about it,0,floods
561,imelda recovery updates flood buckets st paul umc has received flood buckets from first umc crowley louisiana of those have already be distributed or are claimed for people we know already that need them,0,floods
562,the news reporter replied to my tweet the other day saying it came from louisiana but it had to be docked at southwest ship yard and they re the ones that need to be held accountable like twice in less than a year they obviously didn t do something right regardless of flood,0,floods
563,if you live in flood prone louisiana and your gop rep voted against this bill because of concerns about the national debt and lack of funding for trump s idiotic wall you really need to re evaluate your voting priorities if you supported these jerks,0,floods
564,being skeptical of s admin this could be footage of folks escaping flood waters in mississippi or louisiana both have been flooded since january feb at any rate bible clutching profits not helping others in need is paramount level hypocrisy,0,floods
565,in case you need a pick me up today louisiana floods destroy home of who says god sends natural disasters to punish gay people maybe he should spend more time helping the poor and sick and less time obsessing over lgbt people,0,floods
566,i was mad about having a downstairs apartment because im in louisiana and it floods easy but now that its getting hot im so happy lol i dont need to turn on my ac for shit,0,floods
567,due to forecasted river flooding in southeastern louisiana and storm activity in portions of texas a temporary closure for purchasing policies in those areas are in effect dont wait until you need it to purchase insurance it will be too late,0,floods
568,i heard about you from a friend and ive been homeless before and afterwards the flood here in louisiana im a former gamer and want to get back into darkorbit but i dont have the money to pay what i need to finish to get help and i turn on the th,0,floods
569,grafton illinois shows you can t go it alone when addressing as louisiana tackles its own flood risk challenges we need to ensure strategies include our neighbors both upstream and down,0,floods
570,trump is more gracious then you are he writes his own stuff just like he makes his own calls goes to the disasters to give people hope unlike obama couldnt even go to louisiana to help his own brothers sisters in their time of need during the flood bo was to busy golfing,0,floods
571,from floods to tornadoes to hurricanes louisiana is you need to explain this vote against your constituents,0,floods
572,you need a functional governor look at texas florida and louisiana floods state government officials worked with president trump and each other for good outcomes quit crying vote right brown sat there letting dry vegetation instead of clearing it fires,0,floods
573,dearest william flood waters may rise rapids may rage yet nothing shant sway me from my perilous task to make sure no sweet child in louisiana goes to bed without a pickle and upon my return i shall need a pickle from you eternally hillary,0,floods
574,so texas louisiana and fl need to stop building because it floods ever year and kansas oklahoma etc need to stop building because of tornadoes chicago ny it snows too much so no more building there either,0,floods
575,zans spot on youre being obtuse all louisiana practically is a flood zone las home for ppl whove lived there for centuries incl a culture unique to the state nat res abound its the lgst us trade port jobs we need ppl to live there,0,floods
576,yall need to stay safe after going through the louisiana flood believe me nothing else matters except being safe with your loved ones take care,0,floods
577,president trump hang in there never give up we need you now more than ever we love you in baton rouge louisiana  you cared enough to be here with us during the flood of we care enough to be with you always,0,floods
578,i am sure there is much room nfip improvement i will never get i was assigned an adjuster from louisiana who told me he is not responsible ny price tag on contractors materials taxes floods claims need be paid fairly based on that states labor materials tax rate,0,floods
579,we need the intersection of places with lots of people and depth of flood water using spatial joins and density mark types this is where work should be done in louisiana,0,floods
580,mississippi river flood update areas north of st louis from louisiana to clarksville are forecast to be a little more than foot below the record of  there are other rivers flooding too and if you need crest info click here,0,floods
582,the instant he won the presidency louisiana floods msm sneered called it a photo op it was it was effective both politically for those in need the second turning of the tide collapses prepare to be amazed,0,floods
583,raise your hand if you learned in th grade geography why the egyptians flood the nile delta every year as they have for the last  years wetlands loss in se louisiana need not be a mystery unless you re a trial lawyer,0,floods
584,back in most of southeast louisiana was flooded it came out of nowhere ever since our weather channel seems to have developed some trauma as theyve been hyper vigilant about any storm system that rolls in hey news i dont need a flood warning every minutes chill,0,floods
587,stares in louisiana black churches burned down by a son of a law enforcement officer stares in american victims of hurricane michael floods wildfires still seeking relief stares in asylum seeker stares in how much money does richest church in the world need,0,floods
588,why would i need to prove it though i don t lie your acct was to see how far you wanted to risk you wouldn t which shows you weren t sure bc christians do give to the needy a lot i was in louisiana for the floods and panhandle for this past hurricane you need proof too,0,floods
589,at the very least those in south louisiana who have gone without flood insurance for years will need to think hard about that decision donelon said,0,floods
590,the photos here in the arctic where the ice is breaking in the west on fire greece on fire floods in hawaii puerto rico louisiana and houston and storms in the midwest all are evidence of too much carbon in the atmosphere from fossil fuel overuse we need to change,0,floods
591,tell this young very pretty girls mother to sue the ass off that school racist shit sue them they need to change the name of that school before lightning strikes it louisiana home of the redneck trash no wonder god floods it,0,floods
592,the bottom line is you never know and you just need to get as prepared as you can within reason of discusses mitigation projects after the louisiana floods,0,floods
593,so you gonna remember saying we re not from louisiana when you and your family members houses flood in a hurricane and you need a place to go nah you ll be all in north louisiana,0,floods
594,years ago over  louisiana families were impacted by the results of an unnamed storm what started out as a rain event is now known as the great flood of  we are thankful for the volunteers nonprofits churches and neighbors who lent a hand in our time of need,0,floods
595,residents of need a more durable fix for the flood insurance program,0,floods
596,our views residents of louisiana need a more durable fix for the flood insurance program,0,floods
597,disaster floods our views residents of louisiana need a more durable fix for the flood insurance program via,0,floods
598,fire district s new firefighters received training on flood water rescue basics today as new firefighters in southeast louisiana they will need to be familiar with self rescue and personal protective,0,floods
599,before karaoke starts the juke box is empty so naturally i flood it with giving louisiana a real artist to love y all need to jump on the maggie train,0,floods
600,reposted from wildlifeoftravelers this saved the of a and during the in louisiana we need more like him double tap to show your respect credit,0,floods
601,i m from south louisiana a little rain doesn t stop us from doing what we want need to do i like the rain not flood also,0,floods
602,i joined wafb this week to announce the final resolution for duplication of benefits it took far too long but victims of the floods who took out an sba loan will now be able to receive a restore louisiana grant and get the help they need,0,floods
603,where the heck is alto louisiana anyway and why would anyone from alto not need access to the national flood insurance program and disaster relief but bathes in farming subsidies and tariff relief payments,0,floods
606,well that motor vehicle damage thing introduces an interesting double standard insurance companies don t cover what they consider to be acts of god that s why you need flood insurance in louisiana and hulk insurance in new york we can probably capitalize on that and i,0,floods
607,imma need louisiana to stop i m too poor for flood insurance,0,floods
608,if you don t need anything else in louisiana make sure ya got good flood insurance,0,floods
609,water inches away from flooding a home in denham springs that did not flood in  too bad skipped the vote to extend the national flood insurance program nfip earlier this week this homeowner may need the help,0,floods
610,weather in louisiana  yesterday and another  in hrs here with tornado warning and flood warnings you ll never here someone from here say we need an ark,0,floods
611,white flight except its louisiana and it floods really bad in the part all the white people moved to so now they need government assistance and shit,0,floods
613,a look back at which dumped trillion gallons of rain setting a record of inches over texas louisiana in just six days leaving  people in need of rescuing  pic adrees latif reuters,0,floods
614,louisiana news homeowners should be on high alert regarding potential mold a home does not need to flood from a storm to produce the perfect environment for spores to grow according to advantaclean owner brad lynch,0,floods
615,the army ocrp of engineers need to strethen the floods gate sin louisiana but defense projects will all be cut now,0,floods
616,most climate change things i remember from then put most emergencies off until at least  but also you need to understand weve been responding in real time to things southern louisiana floods more than ever but we can still open the unused spillways and build more pumps,0,floods
618,yep amazing how louisiana forgot about how illegal immigrants were brought in to help with recovery after katrina and after the flood ice should not be allowed to step foot anywhere in louisiana how do you hate someone until you need a house repaired or a street cleared,0,floods
619,it is summer and you are in southeastern louisiana no need for any additional potential flood warnings,0,floods
622,so even though our flood worries are leaving us here in the st louis area prayers out for those in louisiana they need it hopefully we dont have a repeat from some years ago,0,floods
623,all media covering the floods in louisiana with the exception of cnn their focus ice picking up illegals who a judge has ordered need be deported americans dealing with havoc in louisiana but cnn concern illegals,0,floods
624,flash flood warning we just received this alert on our phones parish authorities in are urging you to be very cautious if you need to drive anywhere this morning,0,floods
625,like louisiana is down the street they need to let u out that mf fuck the flood,0,floods
626,i for one dont need coverage of new yorks outage or floods in louisiana if i wanted that kind of tv i would watch cnn,0,floods
627,in keeping with liberals thinking on illegal immigration there is no flood happening in louisiana no need to declare an emergency there s only water entering without regulations,0,floods
628,good job chad myers tell these folks the truth about their situation in louisiana no should be trying to soften the truth let folks die on purpose the levees are breaching the mighty missippi is full from floods in northern states u folks need to flee that soup bowl now,0,floods
629,if you dont need to flush dont,0,floods
630,south louisiana if you are trapped in flood waters and need help call the cajun navy louisiana storm patrol at,0,floods
631,i am worried for louisiana my home dont deserve dis give la their lil earthquakes but dont flood the south wtf i need chimes to open on tuesday when i come,0,floods
634,is taking a toll on the gulf coast bringing high and heavy to parts of southeastern louisiana if you need an or please visit be safe,0,floods
635,speed up barry we need you to move in and out quickly from baton rouge walker area louisiana people here can t survive another flood event,0,floods
637,as a precaution or as they say to save your own life these warnings of that hurricane in the tropical advisories for those in the mississippi valley in louisiana rush preparations where they say that you need to evacuate do so the rains and floods could be extreme thank you,0,floods
638,louisiana doesn t need to flood again,0,floods
639,i just told someone sunday that i need to learn how to swim soon cuz floods were coming now look at louisiana smh,0,floods
643,gov cooper wants se north carolina to be styled after louisiana flood building restrictions and planning we need to be considered a flood plai,0,floods
644,should a save that million dollars to help with the flood victims that are going to need assistance in louisiana instead of wasting it on americas dictators parade on the th of july,0,floods
646,declares we all need to take this very very seriously via,0,floods
647,good morning beautiful people to all my friends in se louisiana please make sure youre stocked up on supplies keep computers phones charged stay safe looks like barry will be a slow moving rain flood maker that is not something we need for us all,0,floods
648,hi hot ness it mystifies me why anyone would live in southern louisiana don t need hurricanes to get flooded constant floods,0,floods
650,if your drivers license says louisiana on it you need to have flood insurance,0,floods
653,after reading about the flood warnings for louisiana i told my mom to invest in some sand bags cuz were at risk of flooding she said that because my grandad hasnt flooded yet there was no need to get them,0,floods
654,thats the sela work on jefferson napoleon and louisiana it is a direct response to the flood believe it or not only years down the road were starting to understand we need to do water management differently,0,floods
655,on our way to louisiana for a week pray it doesn t flood or do any serious damage there s a serious storm hurricane of some sort coming we don t need this also going do some work on my house,0,floods
656,trending because people really think that small flood is anything compared to dat bitch yall need to do y all research on louisiana we goodkdkdk,0,floods
657,why they feel the need to lie the may louisiana flood also known as the may southeast louisiana and,0,floods
658,this rain better gtf because the last thing louisiana need is another flood,0,floods
659,louisiana texas lots of rain incoming might on par with the august floods take standard precautions and keep your family save emergency workers get overloaded quickly so lets help keep their efforts focused on those that actually need it handle your business,0,floods
