,text,requesting_help,disaster
64,a link to a gofundme for those being affected by the in the bahamas it has helped in the past with hurricane mathew please use your platform and help share it,1,hurricane
65,after disasters like it is inspiring to see individuals and organizations collaborating to meet the needs of those in crisis today we are thrilled to have partnered with and as we provided safe water for their work in the abacos,1,hurricane
68,family youve already contributed so much for us to aid those who were affected by if you would like to aid us simply lay your contribution at the altar tomorrow at am we ask that you would refrain from sending clothes however  at fellowship bible baptist church,1,hurricane
71,we are doing our best to help the in their time of need please join us at don julio mexican grill,1,hurricane
78,thank you to west palm beach for donating over gallons of water for the bahamas,1,hurricane
80,as part of pbda s various relief efforts nd and rd grades made cards this week for the to deliver to families in the bahamas this weekend the cards will be included in care packages filled with food and hygiene products,1,hurricane
81,we re still collecting supplies to support our brothers sisters recently impacted by in the bahamas review the relief items needed and help us help them by picking up some of the items and dropping them off at the on tomorrow during worship,1,hurricane
83,forced blood drive cancellations donation center closures in impacted areas in times like these we call on donors across the u s to step up and help out to ensure blood needs can be met in storm impacted areas around the u s give,1,hurricane
84,thanks to all who came to top golf yesterday we were also able to gather a lot of donations for hurricane dorian relief,1,hurricane
86,how you can help in the wake of  on the list donate blood learn more at,1,hurricane
91,in the wake of nick sealy thompson is embedded in the bahamas national emergency management agency s eoc working with government and relief agencies to coordinate logistic support and id critical infrastructure needs,1,hurricane
102,we need all hands on deck for our path to recovery united we will grow stronger,1,hurricane
106,please join and help support relief efforts text dorian to  to donate,1,hurricane
117,luxe carnival hurricane dorian relief drive donations of any value are welcomed and appreciated all proceeds go directly to the bahamas for hurricane relief efforts,1,hurricane
121,so proud of our in hours they helped pack  meals to go to the to help the victims of today was an amazing day to be an eagle,1,hurricane
123,join me in partnering with to deliver help and hope to those affected by in the bahamas,1,hurricane
125,naples fla billionaire philanthropist his yacht to  deliver tons of supplies to torn global very caring thank you now is hitting,1,hurricane
128,headknowlesfoundation needs your help in their new location,1,hurricane
130,if you are on and lost belongings due to please see this article for particulars on how you may qualify to receive some funds funds provided will not be clawed back,1,hurricane
134,i went to kellys to support the survivors of by giving blood i was the last donor of the day kellys house and home,1,hurricane
135,join fellows this sunday sept from pm at the lincoln road stage for a free benefit concert for those needing monetary help in the bahamas after being hit by,1,hurricane
136,an anonymous shopper is being praised for spending thousands of dollars on electrical to benefit victims in the,1,hurricane
137,were hosting a second webinar on sept at pm et register and join us to learn about the situation on the ground in affected communities and how best to support long term recovery,1,hurricane
138,meet the cats who survived the bahamas hurricane now theyre in and need your help,1,hurricane
140,if you haven t sent anything yet take some time this weekend and send some needed supplies to the bahamas and survivors even if it s it helps i m sending old clothes and lots of canned soups,1,hurricane
144,sol reliefs hangar may be full but jj lyon guard foundation is still accepting relief supplies address north th street tampa  open days per week am to pm here is a photo of some of the  lbs of supplies thank you,1,hurricane
152,thank you to all those who have donated to our emergency response together we can help restore health and hope to those in need in the be part of the response today,1,hurricane
154,our visitor center is teaming up with to assist those impacted by through the month of september drop off nonperishable food water toiletries batteries flashlights and baby products to adventure court davenport fl,1,hurricane
155,for this weeks find a way to help those affected by it could be something as simple as a prayer to help fund our disaster relief efforts in the bahamas click here,1,hurricane
160,humanitarian aid is still needed to help the people of the bahamas ravaged by have a read and please donate here please rt,1,hurricane
168,the devastation of the bahamas caused by is heartbreaking homes schools and businesses no longer exist people are in dire need of medical care shelter food water clothing and materials to rebuild this weekends is for disaster relief,1,hurricane
170,just bought a tee so happy that teamed up with hot topic to help with lets break the site again,1,hurricane
173,please give a rt of the attached tweet to help out stranded homeless animals,1,hurricane
174,just like that packages sent for some of our friends and family who were affected by,1,hurricane
185,this was my brothers home would you please help them rebuild,1,hurricane
186,has denied ppl of in safe haven to our shores a may soon hit a large swath there will be more displaced where the hell are these people going to get go how will they get the logistical help how many more will die,1,hurricane
188,dont forget people are still dealing with the effects of in the lives were destroyed and they need help to rebuild,1,hurricane
201,our donations also include mosquito nets for and to prevent vector borne diseases due to the increase in mosquitos that can occur following the hurricane,1,hurricane
209,thank you chef you re an inspiration to us all we can all support chef andr s and the great work he s doing through his website,1,hurricane
214,the victims of are still in urgent need of emergency supplies give today  p c dave miller,1,hurricane
217,pan american health world health organization has a permanent presence in and is working hard to support the bahamians and relief efforts in the aftermath of you can help them do their work find out how,1,hurricane
222,after the storm subsided and the waters began to recede a widow was alone to clean up but then knights stepped in to help read more of knights rebuild after hurricane dorian,1,hurricane
224,its a done deal in fort lauderdale mounts bays lh sc pete done met up with his son po we adam done this morning when hms protector called into fort lauderdale after delivering aid to the bahamas,1,hurricane
230,thank you kevin for joining us as we together packed million meals for families in need for those devastated by in the,1,hurricane
233,pets orphaned because of made their way to the hudson valley and hopefully new homes thanks to staff members from paws crossed animal rescue many of the animals will be available for adoption this sunday,1,hurricane
234,additionally we are collecting new and gently used clothing which is being donated to,1,hurricane
249,rt ifrc rt ifrc es the bahamasredcross is distributing basic relief items and household goods to help evacuees and host families cope with new realities thousands of people fled abaco and grand bahama after and are now living in g,1,hurricane
257,in extreme weather like its critical that unicef responds right away this is how we get lifesaving supplies where they need to go,1,hurricane
261,abaco the coopers town community clinic is partially operational days after struck we have been working with national local authorities in the repairs needed so that the population have access to health services,1,hurricane
262,the is distributing basic relief items and household goods to help evacuees and host families cope with new realities thousands of people fled abaco and grand bahama after and are now living in government run shelters or with family in nassau,1,hurricane
264,gary lickle is an airvan who has been actively participating in relief efforts he has been flying loads of supplies to the islands and evacuating refugees to various airports in we re proud to support his efforts to keep the good work going,1,hurricane
266,patrick is and his parents are haitian immigrants in he was a patient for sore throat now he is translating for a stranger mom is so proud,0,hurricane
271,big thanks to for the tour in great opportunity to see first hand how ships like her can play an important role responding to humanitarian disaster her sister ship is which has just responded to in the bahamas,1,hurricane
274,this week the nc congressional delegation sent a letter to president requesting that the administration swiftly approve governor cooper s request for an expedited major disaster declaration in the aftermath of,1,hurricane
277,children now in urgent need after tore through the two weeks ago,1,hurricane
283,the tvs at the gym are finally back up after just in time for college gameday it s like the people around me have never seen a grown man cry,0,hurricane
284,swept across the bahamas as a category hurricane last week and left a trail of destruction agwm relief is helping the national church with immediate relief funds which is the current need heres how you can help,1,hurricane
286,with currently replennishing in the us you can still keep up with the relief efforts with whose teams are operating off hnlms johan de witte via,1,hurricane
291,thanks for your support always count on the operation dorian donations today was the last day of our donation drive for we can t say it enough thank you for your support volunteers with,1,hurricane
293,team running supplies on okracoke island,1,hurricane
298,we pray for all those affected from the aftermath of hurricane dorian in the bahamas if you or anyone is looking to donate you can go to charity navigator and verify the best places to make any donations,1,hurricane
299,after major weather events occur people often think about our insurance policy and if they re covered but what is insurance and how does it really work,0,hurricane
300,when hit parts of the east coast a group of members came together to help out their fellow and anyone else who may be in need of assistance,1,hurricane
301,advanced disposal has created a gofundme account to help its team members with their long term recovery from the damage caused to their homes and lives by,1,hurricane
302,bahamians look for loved ones as  missing after dorian,0,hurricane
303,according to this un news article the is actually saying that  people are homeless in the bahamas in the aftermath of howd they arrive to this figure honestly i would genuinely like to know,0,hurricane
304,as survivors of enter week three of post storm life many in the bahamas worry they will be forced into deep poverty as they scramble to find work in the aftermath of the category storm,0,hurricane
319,if you are assessing damage this weekend remember that crisis cleanup offers free debris removal and cleanup services take pictures of any damage and call to request assistance,1,hurricane
321,if you are assessing damage this weekend remember that crisis cleanup offers free debris removal and cleanup services take pictures of any damage and call to request assistance,1,hurricane
328,thousands in bahamas struggle to find work after dorian,0,hurricane
330,restaurants farmers and fishermen whose business were affected by and may be eligible for grants from visit the link in our profile to learn more,1,hurricane
341,you can provide medical care shelter clean water and other essentials to hurricane dorian survivors by texting the keyword disaster to,1,hurricane
342,our deepest thanks to and for our flights out to the so the rg team can continue our response from the ground your support is hugely appreciated,1,hurricane
343,access to affected people in the remains challenging due to damaged roads and infrastructure we will be providing relief supplies to evacuees in nassau and new providence want to help our relief efforts donate here,1,hurricane
346,officials are planning to erect two tent city relief centers capable of housing around  people around hard hit marsh harbour on great abaco island,1,hurricane
353,this is so sad heartbreaking lets help figure out who this lady is and get her some help,1,hurricane
359,daytona united for bahamas efforts are in full swing locally to help victims in the impacted by local organizations,1,hurricane
365,thousands in bahamas struggle to find work after dorian,0,hurricane
368,government and to bring  children back to school unicef un  moreno gonzalez,0,hurricane
389,we got back from bahamas for a planned vacation and it became so much more we worked with to help with relief i worked triage with amazing nurses doctors and search and rescue teams please volunteer or donate if you can,1,hurricane
394,please if you or someone you know is missing and or trying to find someone else send your info and ill retweet to try and help signal boost,1,hurricane
398,halfway to the goal of  to help with the usf relief efforts for the hurricane ravaged every penny helps donate today  learn more,1,hurricane
399,sunset park is doing a hurricane relief fund for the bahamas we are doing a little friendly competition for the house that brings the most money let s help make a difference for those in need donation drive runs until september th,1,hurricane
404,leaders in the say that while donations are appreciated continuing travel to the bahamas is the best way to help heres why,1,hurricane
405,after dorian resolve marine group provides bahamas with a water purifying plant,1,hurricane
419,because if you we were able in our first shipment to deliver over k lbs of relief into the island of grand bahama to bring help and hope to those affected by,1,hurricane
421,hey all as people are still cleaning up from there are still many animals that need rescued and transported to other shelters if not for and their volunteers these animals wouldn t be able,1,hurricane
426,survivors have been found in a remote area not far from airport theyve been without communicate or food since the storm,0,hurricane
428,daytona beach fbo is offering discount fuel for anyone involved in relief flights in and out of the bahamas and waiving fees for those flights,1,hurricane
441,i guess is out of water i just want water for me forget the hurricane,1,hurricane
447,the city of will be distributing sand bags tomorrow fri aug from noon to p m or until supplies last at mills pond park nw ave limit bags per vehicle must show proof id you live in city,1,hurricane
459,some publix stores ran out of water very fast this morning all that s left are these cases of water for  seems that no one wants to pay the high price,0,hurricane
469,getting some sandbags to prepare our house for the hurricane this weekend hurricanes are just another part of florida living hope everyone stays safe this weekend,0,hurricane
471,with threatening a strike and a state of already declared in aerial footage shows a massive line of cars in waiting for sandbags packed by,0,hurricane
477,folks are preparing and stocking up for almost all retailers are out of water in southwest florida many gas stations are out of gas,0,hurricane
489,so i work at a supermarket from centered on the east coast and we have been incredibly busy all day due to the hurricane here are a couple pictures of the bread and water aisles,0,hurricane
490,why much of the work of preparing for a comes long before a community finds itself in one s crosshairs,0,hurricane
505,im hoping to fine some help i been living in a trailer full of mold from the flood in south louisiana i been looking for help but cant fine any had a heart attack and heart surger i need to fine a camper or a good used trailer please help if you can thank you,1,floods
512,hi bill i pray that i will be the recipient of this money my brother in law who is a disabled veteran with diabetes and my sister are in great need their home was damaged in the flood of in baton rouge louisiana and still has not been repaired,1,floods
514,im a disabled veteran that lost everything in the flood here in louisiana in wife is also disabled everything we owned was paid for we had to replace our home and our now we have to start all over again we need about  to pay,0,floods
516,my wife and i are both disabled and need help to pay off our mobile home and our car that we had to get after the flood of here in louisiana my gofundme account williemcdonald com,1,floods
519,these students have experienced extraordinary challenges after the flood we don t need to exacerbate that or make it worse by also taking resources away from our schools disaster recovery reform to give south louisiana schools millions in aid,1,floods
520,will pray for her gretchen as our area of louisiana was ground zero in the great flood of i can tell you they need manpower immediately to get in get house gutted to begin the dry out process sort through items take things to the road etc can any sweet vets help out,1,floods
526,new from et al the unexpected mid state louisiana flood with special focus on the different rescue and recovery responses it engendered tl dr we need more analyses of flood and rescue needs along with social vulnerability,1,floods
527,we need some state closures for this rain every now and again it s pretty hard to reach your destination if one rainfall floods the whole city,0,floods
528,do you mean the way you were kind years back to the people at louisiana that got hit with fatal floods and you had your building closed to those in need while you were safe and dry in your multi million dollar home that you purchased from everyone elses money,0,floods
530,whether you need louisiana homeowners insurance landlord insurance condo insurance renters insurance or flood insurance we can provide great rates,0,floods
532,happy th birthday to randy newman this song was written to commemorate a louisiana flood in but has poignancy for any time folks are abandoned by government in a time of need,0,floods
533,i d like to know what the delay is in signing the waiver for fund to be released to flood victims in louisiana we need this money to finish our homes many i know are depending on these funds sba loans are not the answer for many,1,floods
534,trump taking fema political with these statements as he threatens california to withhold funding after deadly wildfires and now deadly floods al does need assistance so does purto rico calif n s carolina louisiana,1,floods
535,im not trying to play games here but a lot of flood victims in louisiana are waiting on they need hud to issue duplication of benefits guidelines so they can rebuild their homes and get on with their lives,1,floods
541,if anyone who sees this is able to help please central louisiana recently experienced flooding and my rent is due and my car didn t have flood insurance i have two more days for rent and i only need k i made a twitter because i heard about you,1,floods
542,here can be seen advocating for government involvement in money and hopes to secure some tax payer dollars to be redistributed to those who need protections from historic natural floods good for him i suppose,1,floods
543,both texas and louisiana can improve flood control but where can the carolinas put all that water could you move it into georgia money better spent than a mexican wall we need better flood control,0,floods
544,gm the flood victims really need the basics ice water food generators the little towns are hurting the worst show the others up show them what you can do you took a semi to louisiana when obama golfed can you take semis in for other goods too,1,floods
581,day of ended w mayor singing s louisiana  so heres a map of the levee system planned in response to that flood we need a new holistic approach to transform water from threat to asset,0,floods
585,before we do that can you donate rt the link below to help get them to million before politics floods our screens today the churches in louisiana need donations to make their churches bigger safer,1,floods
586,some towns in fear they will never recover from the flood puerto rico has not recovered flint still doesnt have clean water historically black churches in louisiana need to be repaired or rebuilt,1,floods
604,duplication of benefits for louisiana flood of  still waiting on guidelines from hud passed into law in october  people are suffering we should not have to wait any longer release the guidelines so we can get the help we need,1,floods
605,duplication of benefits for louisiana flood of  still waiting on guidelines from hud and omb passed into law in october  people are suffering we should not have to wait any longer release the guidelines so we can get the help we need,1,floods
612,and have no vision for louisianas future heres our vision for  end dependency on oil and tourism money  get the healthcare and education we need for everyone build the best flood fighting infrastructure in the country,0,floods
617,big fish kill after tropical storm barry in louisiana myrtle grove marina louisiana we need help to build a flood gate please make this go viral thanks,1,floods
620,dogs of need a home boots of hope joni stafford  loop road prairieville la  bootsofhope com,1,floods
621,from hurricane barry igive us presidents executive order authorization for we need extend supports on moments for give hands assistance help save emergency our everyone us people living on this area of flood in louisiana with other state of us america,1,floods
632,t s barry will hit tonight in august  louisiana flood rescue august was born if reactivated we will be seeking resources from outside of la anyone who can assist in any way we may need your help i will keep you all posted thank you pray for louisiana,1,floods
633,yes this baby hurricane could be devastating the mississippi river our tributaries are swollen if barry slows his exit from louisiana we just may have a repeat of the great flood we need barry to get a move on get in get out prayers would be great,0,floods
636,mr president u r a builder we need louisiana protected from huge storms like this and the flooding that happens please come up with a concrete plan to design a barrier that can keep the floods away our people in this state need relief from disasters like this in the gulf,1,floods
640,need prayers for all national guard units that have to work the flood in louisiana we have lives to but here to protect serve including myself have to leave out,0,floods
641,omg not again the people of louisiana need to vote out the people that are running your state they dont care about yall here we go again with another flood they need to bring in some engineers to build a better levie,0,floods
642,louisiana declares state of emergency we all need to take this very v  via warning for areas prayers needed now for people struggling in flood waters,0,floods
645,senator we in louisiana need protection on the level of what the netherlands does in the form of flood protection,0,floods
649,louisiana is going to cease to exist if something isnt done about climate change they are right at the ocean and the sea levels have gone up meaning that louisiana will flood worse than hurricane katrina protections need to be put in place you dont just say its nothing,0,floods
651,i m gone for a month and south louisiana up and floods we need to work on the drains and our levees,0,floods
652,we need to build some with apartments for the people in  because of the year will happen before july,1,floods
663,farmers need your support now more than ever president trump i m sure you are aware all crops were destroyed by floods this season especially in nebraska frames are hurtin,1,floods
666,one more day to send items of need to families in and who have been impacted by floods this year,1,floods
667,join me in helping our neighbors in and get items they need after floods,1,floods
674,private levees are a key part of nebraska flood prevention officials need to include them in the states overall flood protection strategy our editorial says,0,floods
679,pine ridge indian reservation in nebraska n south dakota the lakota nation got hit hard by the floods fema says only out aprx k people that s there they can t get to them no transportation or no electricity no potable water very little supply s coming in they need ourhelp,1,floods
685,crowd shot from tonight loved this audience please give what you can to help out nebraska flood victims don t know a website but please google it these people need and deserve assistance as they pick up,1,floods
688,nebraska flood update rain most days this week we are back into flood warnings communities that were coming out of the water are back under more rain to come this weekend need prayers and continued support,1,floods
690,alumni dennis leonard and mark teahen visited and met with service members today at offutt air force base in bellevue nebraska the base will need at least million to repair or replace structural damage sustained during the march floods,1,floods
695,is this not enough to motivate you to fight for nebraska flood victims what do you need when are you going to grow a pair of stop being the boot licking trump sycophant and get the funding we need you have failed nebraska,1,floods
