,text,requesting_help,disaster
1445,a community assistance center was set up in healdsburg for folks who have been impacted by the and power outages has details,1,fire
1456,help us support relief effort by buying a ticket to the best of wine country tasting awards event by sf mag at the pearl in dogpatch nov all proceeds go to the sonoma county resilience fund tix from pp,1,fire
1459,thoughts san francisco resource center to help kincade,1,fire
1464,tegan doing some great things in healdsburg and organizing support and care for many impacted by the i encourage you all to donate if you can,1,fire
1469,sonoma county and state agencies and local non profit organizations like the american red cross have opened one stop local assistance center lac today for those impacted by the,1,fire
1473,more good news containment grows to new assistance center opens through wednesday  via,1,fire
1478,attending corks forks want to help members of our industry impacted by the bring gift cards to donate for distribution to hospitality industry pros impacted by the fire target amex visa are faves but any cards are appreciated,1,fire
1480,live assistance center for kincade victims opens,1,fire
1481,residents are lining up at the local assistance center in healdsburg kincade fire evacuees will get access to check on their property,1,fire
17,south florida about to have a very musical hurricane on our hands,0,hurricane
21,so will be im loaded with beer and water,0,hurricane
42,instead of having grey matter in brain he has straw full on brown matter from a donkey shat nuke hurricane dorian lunacy isn t a strong enough word if he only had a brain hatforbrains,0,hurricane
50,i was really hoping not to need my annual hurricane supplies list but looks to be heading this way stocking up today just in case,0,hurricane
107,job openings our applications are now open for the as we ramp up our operations after we are looking to fill a couple of key positions please share rt or directly apply here,1,hurricane
215,teams up with happy hope factory to provide a critical smile to children currently hospitalized as a result of,0,hurricane
220,time is of the essence technology is an effective way to build resilience and reduce reliance on diesel generation if theres any good news its that microgrids were already on their way before read more,0,hurricane
235,you lost your house and everything in it show me your papers or you cant leave if only they were white,0,hurricane
237,morning trip to sweetings cay with the deputy prime minister k peter turnquest for a damage assessment to warn residents of the incoming storm and discuss long term recovery plans for the east end,0,hurricane
238,i m completely fucking done with having no power today marks a full fucking week without that s a complete joke,0,hurricane
252,is there because we know people have been in disasters and dont have their paperwork if we need to verify peoples background and identities we have the resources to do that ref rejecting evacuees,0,hurricane
253,trumps cruelty knows no bounds imagine being in the bahamas and hits how would anyone say sorry you cannot evacuate to the usa no protected status for you get off the ferry stand there w nothing,0,hurricane
0,offically tropical storm dorian where is it going tropical depression hurricane dorian track  the latest on the storms track in the above youtube link,0,hurricane
1,tropical storm dorian projected path spaghetti models,0,hurricane
2,to become a this week a system located hundreds of miles from the lesser antilles is expected to become tomorrow it is also forecast to become later this week start preparing now,0,hurricane
3,update tropical storm dorian strengthens expected to become hurricane,0,hurricane
4,live tonight pm est  d railed episode pga tour fed ex cup lightning strike hurricane dorian wizard of oz list,0,hurricane
5,my little x island doesn t need this still so many houses with go visit ttrump,0,hurricane
6,breaking news allure of the seas changes itinerary to avoid hurricane dorian over cruisers on ship,0,hurricane
7,what s up,0,hurricane
8,here we go better be prepared and hope learned from no to politicians  tropical storm dorian forms in atlantic could become hurricane by tuesday,0,hurricane
9,is threatening the caribbean and more storms could soak the us coast more than likely later this week,0,hurricane
10,cruise ships  passengers may be affected by hurricane dorian this week may hit puerto rico,0,hurricane
11,it is official we now have are you ready for complete checklist,0,hurricane
12,look i m a hurricane and friends and family please be prepared and safe,0,hurricane
13,yeah i heard lol,0,hurricane
14,me thinks if is anything like it s namesake john dorian all it wants is a hug off,0,hurricane
15,just have your president drop a nuclear bomb to the hurrican it s actually something he suggested,0,hurricane
16,has nothing on vlamis,0,hurricane
18,and don t forget whats coming to us get your water people or even saturday,0,hurricane
19,caribbean storm coming we may get the edges of hurricane dorian tomorrow soldier bay,0,hurricane
20,this a serious storm ironico mi nombre y soy kleema como el clima lol word i feal gifted i am kleema el clima,0,hurricane
22,puerto rico declaring state of emergency,0,hurricane
23,barbados st lucia and everyone in dorian path be safe and be smart,0,hurricane
24,possible that cant be good,0,hurricane
25,regarding aka i hopw it dont turn into i hope  and others in florida and georgia louisiana alabama mississippi stay well and be well,0,hurricane
26,fuck no dude i have shit planned re this aint good,0,hurricane
27,hoping this is a good place to share this thread,0,hurricane
28,i have a friend named dorian lived close to me havent seen him in a minute,0,hurricane
29,being bored on house arrest doesn t mean passing time watching updates,0,hurricane
30,coverage prepares for possible as tropical storm approaches via broadcast cable in puerto rico mainland usa check local cable listings for wapa america,0,hurricane
31,wait you live in florida,0,hurricane
32,ay yo you better cut it out bro bad timing i have things planned this weekend bgone wannabe irma i will fight you,0,hurricane
33,puerto rico forecast to feel impact of hurricane dorian this week,0,hurricane
34,if you want to slow down the upcoming epic levels of fl panic hoarding just nudge the graphic a bit to show the storm may consciously decided to just ignore us,0,hurricane
35,will the city be helping puerto rico with recovery post,0,hurricane
36,stay the fuck away,0,hurricane
37,fingers crossed it passes us,0,hurricane
38,you guys are panicking everything going to be fine please help us,0,hurricane
39,well it is that time again right on cue i will keep you all dated but most of all keep all my close friends posted on this because this could be down played tons,0,hurricane
40,projected path center omg  dorian c,0,hurricane
41,a little love to this pup in after hurricane maria hoping will sit stay away,0,hurricane
43,the long line for boxes of water at sams,0,hurricane
44,hurricane dorian is going to hit too close for comfort so we are moving south to be as far as we can get from landfall,0,hurricane
45,winds of miles an hour everyone on the east coast georgia south carolina and north carolina should be prepared for hurricane,0,hurricane
46,let this storm come and go in peace we the ppl of svg dont need no stress ok,0,hurricane
47,hurricane has its eyes on central florida we will see we are due again next weekend maybe another hurricanefrenzy,0,hurricane
48,fourth of september  is the th day of the year weather manipulators  category hurricane,0,hurricane
49,tropical storm approaching to bridgetown,0,hurricane
51,anywhere from south florida to the outer banks should keep a close on on potential this labor day weekend,0,hurricane
52,staff have asked the to do a little practicing with regards to,0,hurricane
53,i m happy  and have a today and that we decided to change itinerary and not cruising east towards this week,0,hurricane
54,mr president is bearing down on the south nuke it what what what nuke it,0,hurricane
55,seems to be on track for good times tis the season but still to early to tell,0,hurricane
56,our top stories on the summit wraps up today china says it wants to talk again about trade its the st day of classes for students including those at the new downtown campus and could soon be w fl in its path,0,hurricane
57,update tropical storm dorian up to mph forecast tracks target florida,0,hurricane
58,is expected to get a pay raise become grey residents are asked to hide all mirrors kinda like the hid the ships named after senator from trump,0,hurricane
59,expect to morph into grey yeah but don t expect him to be looking into any mirrors to self inspect his rakish digs from the new new pretentiously expensive line,0,hurricane
60,dorian could be hurricane when it reaches puerto rico,0,hurricane
61,praying for puerto rico i pray that god will protect all families and homes in jesus mighty name,0,hurricane
62,live now  d railed episode pga tour fed ex cup lightning strike hurricane dorian wizard of oz list,0,hurricane
63,new video by hurricane dorian predictictive programming in literature the invisible death by victor rousseau,0,hurricane
66,how convenient to make a or was that also our own government like our military should know or the usa attacked the oil refinery top off i have gallons from,0,hurricane
67,help us reach the goal of  to help with the usf health relief efforts for the hurricane ravaged every penny helps donate today  learn more,0,hurricane
69,the work continues hurricane dorian relief collection sunday  pm,0,hurricane
70,one week ago today that a crane collapsed that hit a building under construction in halifax because of hurricane dorian,0,hurricane
72,thousands lost their homes when swept through the please continue to pray for this ongoing crisis pray for help and resolution for disaster victims,0,hurricane
73,lutheran world relief is responding to the crisis in the where has caused massive damage we are coordinating with our partners in the caribbean to assess the damage and plan a relief response,0,hurricane
74,think how this would help in areas like the bahamas after would seem to me to be a fairly quick way to help in areas where people have lost their home just a thought,0,hurricane
75,moved away from the bahamas after dumping rain on parts of the archipelagos northwest region that were already hammered by two weeks ago the system is currently packing maximum sustained winds of mph,0,hurricane
76,tikitenders weather report palm coast marina temp f humidity  winds northeast mph,0,hurricane
77,after category ravaged the bahamas media news outlets completely ignored the incredible ways the private market had already started to help while nobody was paying attention,0,hurricane
79,thank you councilor ken clifton for the hard work and dedication,0,hurricane
82,heart  rapid response team reports the devastation in the bahamas is difficult to comprehend,0,hurricane
85,help me help the victims of hurricane dorian,0,hurricane
87,well there is the solution to a problem already in practice,0,hurricane
88,thank you cama and everyone who came out and participated and donated in the relief fund it was a great success and we are continuing to accept donations at any,0,hurricane
89,grand bahama just in lashes an already devastated parts with heavy rain and strong winds on saturday reports,0,hurricane
90,country music allstars coming together with to raise money for the relief efforts in the bahamas victims tune in and thanks,0,hurricane
92,its still not too late a day out for a,0,hurricane
93,our hearts with victims we pray for god give them safety calling for global to supporting you un general secretary for your biggest efforts,0,hurricane
94,it s our fgm come see what our club is all about and or drop off any of your donations,0,hurricane
95,as response to continues dr erin hughey of pdc discusses how mega storms are leading to changes in anticipatory sciences and the role of the national disaster preparedness baseline assessment,0,hurricane
96,have you checked out the latest episodes of this past week we talk crypto cannabis ty to our sponsors and for making it happen you can hear it all at shout out to,0,hurricane
97,bbc news new storm hits two weeks after storm,0,hurricane
98,chillin in my new shirt thanks and for donating the proceeds to acts of kindness for victims,0,hurricane
99,we care for you and although this may take time we will get through this together said peter kerr president of the church in the atlantic caribbean union to dozens of church members from abaco and grand bahama taking shelter across after,0,hurricane
100,grateful to be listed on as an organization providing relief to those impacted by,0,hurricane
101,the other night my customers thanked me for bringing joy to their evening and then left an incredibly generous tip so i decided to pay some of it forward to two causes that have been weighing heavy on my heart this month,0,hurricane
103,become tender with the earth was a it s past time for,0,hurricane
104,reached category intensity on september becoming the strongest to affect the northwestern bahamas in the modern record via,0,hurricane
105,rt undp rt antonioguterres i just landed in abaco in the bahamas i m horrified by the level of devastation i ve never seen anything like this was not category but category hell it s time to wake up and take urgent,0,hurricane
108,rihanna to help bahamas recovery,0,hurricane
109,thread by,0,hurricane
110,top story this is the control room from where the response to is being coordinated by the bahamas government other organizations i was very proud to see un colleagues be part of see more,0,hurricane
111,finally got out to photograph some of the birds that hurricane dorian brought in this laughing gull was the perfect model today at sunrise,0,hurricane
112,still reeling from dorian bahamas faces tropical storm humberto,0,hurricane
113,long day for team team from our rescue response team,0,hurricane
114,astra club is having a bake sale on tuesday september all proceeds will go to a bahamas relief fund to provide assistance for damage from hurricane dorian,0,hurricane
115,just arrived back in terrace bc and saw my english professor at walmart and the way he hugged me and told me he was so happy to see me made me even more grateful,0,hurricane
116,thank you for hosting this project through their allowing our players the opportunity to help prepare  for the victims of in the,0,hurricane
118,dear this is what a real looks sounds and acts like sadly you wouldn t know anything about this so just continue directing government business to your resorts you are disgusting,0,hurricane
119,we miss having a who cares about people,0,hurricane
120,rt i just landed in abaco in the bahamas i m horrified by the level of devastation i ve never seen anything like this was not category but category hell it s time to wake up and take urgent,0,hurricane
122,are you and your pet ready for download your free disaster preparedness checklist now,0,hurricane
124,about that life feat lil joey prod by lothamonsta and ariaizagc via thank y all for supporting about that life click here if u about that,0,hurricane
126,according to  of impacted over million people  may have passed but isn t over yet,0,hurricane
127,helping some bahamian children in the aftermath of this weknd,0,hurricane
129,dorian update as new storms threaten the safety of the people of the nethope works to bring the powerline of to aid first responders those already impacted by keep this work going with your gift,0,hurricane
131,they lost of their companions in now these and are ready for new homes  via cc,0,hurricane
132,hi my name is sam wyatt and i want to help the people in the bahamas that lost everything to hurricane dorian i made these hats to help those in need  of the proceeds will go to a hurricane dorian bahamas relief fund,0,hurricane
133,football resumes atlantic too much for seabreeze local prep teams are glad to be back to playing after wiped out games and practices last week on monday,0,hurricane
139,newsweek florida governor ron desantis wants bahamians fleeing widespread destruction caused by to stop coming to his state,0,hurricane
141,a second florida to bahamas round trip humanitarian cruise was set to sail this weekend,0,hurricane
142,was a injustice the,0,hurricane
143,proud to partner with which today delivered emergency relief supplies to to help communities affected by a great example of the u s government u s private sector working together to save lives,0,hurricane
145,now that is long past i figured it was time to come up fired a off a ping today but it ended up being a z ping sorry,0,hurricane
146,thousands of to find after,0,hurricane
147,a disaster distress helpline is available at the provides immediate crisis counseling for people who are experiencing emotional distress related to disasters like,0,hurricane
148,has restored to  customers in eastern following,0,hurricane
149,please if you can,0,hurricane
150,theres more trouble for the hurricane ravaged is threatening island creating new worries for more than  people living in shelters after,0,hurricane
151,of  abscbnball,0,hurricane
153,rt antonioguterres i just landed in abaco in the bahamas i m horrified by the level of devastation i ve never seen anything like this was not category but category hell it s time to wake up and take urgent,0,hurricane
156,rt we re encouraging all realtors and friends to donate to the to help those impacted by let s show the world how realtors care,0,hurricane
157,infrastructure climate change after dorian has drowned the and devastated the coasts of north and south there are trillions of dollars worth of damages,0,hurricane
158,wheels up huge thanks to s search rescue an amazing group of people dogs who worked so hard on s response searching more than k homes buildings in the for survivors safe travels as you head home to,0,hurricane
159,i just landed in abaco in the bahamas i m horrified by the level of devastation i ve never seen anything like this was not category but category hell it s time to wake up and take urgent,0,hurricane
161,just landed more has arrived in thanks to our partner the critical relief supplies delivered today will help at least  people recovering from,0,hurricane
162,lashes seen becoming just weeks after ravaged the islands,0,hurricane
163,to the people of the bahamas we are humbled by your strength and resilience after we wish you the best in your ongoing rebuilding and recovery,0,hurricane
164,tropical storm lashed the with rain and wind on saturday possibly slowing down relief efforts in the wake of the devastation wrought less than two weeks ago by,0,hurricane
165,starting week off right with a donation with hit,0,hurricane
166,data shows a drop in the number of federal flood insurance policies in the counties that were under evacuation orders education is needed to help property owners understand,0,hurricane
167,the situation in the remains critical with thousands left homeless and food and water scarce please continue to pray that relief and hope would touch the lives of those who have lost so much,0,hurricane
169,on the ground un secretary general showing support to all humanitarian workers in the most badly affected area in the,0,hurricane
171,n adventure embarking on an aid mission to the bahamas,0,hurricane
172,want to help out after donate to the north carolina disaster relief fund,0,hurricane
175,press release,0,hurricane
176,knowing could cause unprecedented damage still chose to transfer funding from to support his policy why to move forward his political agenda ignoring the safety of americans refugees,0,hurricane
177,many thanks to for featuring obr s head of technology jeremy bruce and what he is seeing in the bahamas while serving the one hot meal that matters,0,hurricane
178,one voice one response many moving parts tsf participated in a coordination meeting at the national emergency management agency emergency operational center in nassau,0,hurricane
179,email donations rolling in beyond thankful,0,hurricane
180,dang the winds are stronger today in orlando than they were with,0,hurricane
181,did you know that natural disasters dont just take a physical toll on affected populations but a mental one as well see how our member is addressing the damage you cant see in the aftermath of,0,hurricane
182,direct relief for hurricane dorian help victims of dorian today help prepare others and during disasters great site,0,hurricane
183,rt  did you know that we are the only agency w permanent presence in we have had an office here for yrs proud to,0,hurricane
184,not sure she realizes the twisted irony of an undocumented haitian immigrant wearing this shirt in bahamas,0,hurricane
187,in the wake of this artist is donating the proceeds from his new exhibition while other arts organizations join forces to raise resources for the victims,0,hurricane
189,one of our team leaders had the honor of meeting secretary general as he visited abaco bahamas to survey the ongoing response and recovery effort for,0,hurricane
190,diary of cat adjuster day friday,0,hurricane
191,in abaco today s disaster team had the honor of meeting secretary general during his trip to the island to survey response and recovery,0,hurricane
192,thanks to the at for being so supportive as i balance being a full time humanitarian with studying towards an msc in international disaster management,0,hurricane
193,criticism of response to is spot on he points out the shame in using the islands as their playground before turning their backs on the nation that greets tourists with open arms,0,hurricane
194,rt  did you know that we are the,0,hurricane
195,on sunday  we re hosting a fun workout class led by the one and only at with proceeds being donated directly to those affected by everyone who joins will receive the famous sea salt cream cookies donut and more,0,hurricane
196,how hurricane dorian could impact ocean shipping,0,hurricane
197,such a pleasure lending a helping hand during ole miss saacs relief drive yesterday our thoughts go out to those affected in the bahamas,0,hurricane
198,here i am in my doggie raincoat ive never lost everything in a storm support tummy filling life saving world central kitchen they go wherever theyre needed and now theyre in the bahamas,0,hurricane
199,got me disoriented no i gotta keep pushing though realizing what who i m working for everyday thanks to all my unks and aunties for supporting me during this rough ass time with talks,0,hurricane
200,that moment your about to get dropped in on,0,hurricane
202,take a look at disneys private island on the first sailing post,0,hurricane
203,has formed near the as the bahamian people are still working to repair the damages done by category,0,hurricane
204,took rescue into her home to protect them from hurricane dorian,0,hurricane
205,if youre unsure about where to donate to help victims heres a good place to start,0,hurricane
206,grey was the first ever to fear aging,0,hurricane
207,our first medic team arrived in today working with in aiding victims of in the hardest to reach areas,0,hurricane
208,grey was the first ever to fear looking at itself in the mirror,0,hurricane
210,have you been considering investing in hurricane impact windows or shutters after the recent hurricane weve broken down all of the pros and cons of each option in our latest post,0,hurricane
211,rt we re thinking of those impacted by has donated k in product to  foundation donated k to to support those impacted in the,0,hurricane
212,update sea shepherd heads to the sea shepherds crew bring aid to the most remote and hardest hit islands in the bahamas,0,hurricane
213,still reeling from faces tropical storm,0,hurricane
216,listen to our broadcasts brings strong wind rain to areas of the northwest hit hard by white house confirms death of osama bin ladens son and designated heir to lead al qaeda,0,hurricane
218,alycethoward is hosting a for the recovery from at her tomorrow sunday at if you re in and want to shake your booty for a cause bigger than that,0,hurricane
219,sad story in tragedy thanks sir for care on victims and made situation better,0,hurricane
221,access to about images of the in the immediate aftermath of,0,hurricane
223,good news for made life better from attack with support all colleagues happy weekend sir,0,hurricane
225,did you know that we are the only agency w permanent presence in we have had an office here for yrs proud to support people relief efforts delivery of donations to ensure that population affected has access to safe,0,hurricane
226,extreme weather the remnants of caused the biggest prize in the camanachd cup final to be abandoned after half time the score was between newtonmore oban camanachd at a v wet windy an aird fort william replay details to be confirmed,0,hurricane
227,topsider homes survive hurricane dorian see more here,0,hurricane
228,help those affected by  online shopping for disaster relief at amazon com  via,0,hurricane
229,bless all the volunteers,0,hurricane
231,i hid my grandson i knocked on gods door as i saw the water rising he took my husband he took my two daughters under the water but he left me with this boy,0,hurricane
232,the are active again is heading through the again then it looks like a turn similar to but this will take it through,0,hurricane
236,new episode podcast on the inaugural retreat interview sanaa su show topic this week piper carter cohost brittany are joined by songwriter songstress,0,hurricane
239,today a few hundred people will volunteer to help of,0,hurricane
